objectid,filename,youtubeid,vimeoid,title,creator,date,description,subject,location,latitude,longitude,source,identifier,type,format,language,rights,rightsstatement
wlc023,wlc024.pdf,,,"Mineral County v. State, 117 Nev. 235",,2001-04-11,"Petitioners, a county and a private not for profit organization, sought a writ of prohibition to prevent respondents, the state, the department of natural resources, an irrigation district, and others, from granting additional rights to withdraw surface water or groundwater from a river system. Petitioners also sought a writ of mandamus challenging respondents' public trust obligations in managing and appropriating the river's water flows into a lake at the end of the river system. The supreme court denied the petitions, holding that the federal court, which had continuing involvement in the monitoring of the river system for more than 80 years, was the proper forum for the redress that petitioners sought. The decree previously issued by the federal court involved the allocation of interstate waters between California and Nevada, and a consistent and controlling interpretation by a federal court of competent jurisdiction was more appropriate. In addition, the supreme court lacked jurisdiction over several interested parties, including an Indian tribe and the United States.",lakes;rivers;appropriation;reservation;reservoirs;public trust;natural resources;navigable;surface water;NRS 34.160;NRS 34.320,"Mineral County, NV",38.688254,-118.693706,117 Nev. 235,,Case Law,application/pdf,,,
wlc024,wlc025.pdf,,,"South Fork Band of the Te-Moak Tribe of W. Shoshone Indians v. Sixth Judicial Dist. Court, 116 Nev. 805",,2000-08-24,"Real parties in interest, water commissioners and state engineer, sought an order from respondent district court directing petitioners, Indian tribe, to show cause why they should not have been held in contempt for frustrating the enforcement of water rights. Petitioners claimed the district court was without jurisdiction based on their sovereign immunity. Purchase of the reservation land subject to previously adjudicated water rights constituted an express waiver of sovereign immunity, and petitioners' actions in benefiting from and abiding by the Humboldt Decree for more than five decades served to ratify this waiver. District court was therefore within its authority in exercising jurisdiction over petitioners concerning the alleged interference with the administration of water rights pursuant to the decree. Petition for writ of prohibition was denied.",reservation;rivers;NRS 34.320,"Humboldt County, NV",40.81467416,-115.7636066,116 Nev. 805,,Case Law,application/pdf,,,
wlc025,https://www.leg.state.nv.us/Statutes/02nd1866/Stats186602.html#Stats186602page202,,,"Right of Way for Ditches and Flumes,1866 Nev. Stat. 202",,1866-03-03,"An Act to allow any person or persons to divert the Waters of any River or Stream, and run the same through any Ditch or Flume, and to provide for the Right of Way through the Lands of others.",rivers;streams,,,,1866 Statutes of Nevada,,Historical Statute,record,,,
wlc026,https://www.leg.state.nv.us/Statutes/14th1889/Stats188901.html#Stats188901page51,,,"Irrigation Act, 1889 Nev. Stat. 51",,1889-02-28,An Act defining and prohibiting the unlawful diversion and waste of water.,irrigation;rivers;creek;streams,,,,1889 Statutes of Nevada,,Historical Statute,record,,,
wlc027,https://www.leg.state.nv.us/Statutes/14th1889/Stats188901.html#Stats188901page96,,,"Undisturbed Right of Flowing Water, 1889 Nev. Stat. 96",,1889-03-09,"An Act to amend an Act entitled “An Act to allow any person or persons to divert the waters of any river or stream and run the same through any ditch or flume, and to provide the right of way through the land of others,” approved March 3, 1866.",ditches;flumes;flowing water,,,,1889 Statutes of Nevada,,Historical Statute,record,,,
wlc028,https://www.leg.state.nv.us/Statutes/14th1889/Stats188901.html#Stats188901page102,,,"Board of Reclamation Commissioners Created, 1889 Nev. Stat. 102",,1889-03-09,"An Act to provide for the storage of water, to encourage milling, mining and internal improvements and to reclaim the arable desert lands and develop the agricultural resources of the State of Nevada, and to provide funds for the payment of the same.",appropriation;waste;dams;canals;irrigation,,,,1889 Statutes of Nevada,,Historical Statute,record,,,
wlc029,https://www.leg.state.nv.us/Statutes/14th1889/Stats188901.html#Stats188901page107,,,"Irrigation Districts, 1889 Nev. Stat. 107",,1889-03-09,"An Act to regulate the use of water for irrigation and for other purposes; for settling the priority of rights thereto, and to punish the unlawful interference with such rights; to provide for the condemnation of land for reservoirs; for recording claims to water rights, and the appointment and duties of Water Commissioners.",irrigation;reservoirs;ditches,,,,1889 Statutes of Nevada,,Historical Statute,record,,,
wlc030,https://www.leg.state.nv.us/Statutes/19th1899/Stats189901.html#Stats189901page51,,,"Legislature Amended Irrigation Act, 1899 Nev. Stat. 51",,1899-03-07,"An Act to amend an Act entitled “An Act to provide for the organization and government of irrigation and water storage districts, and to provide for the acquisition of water and other property, and for the distribution of water thereby for irrigation purposes,” approved March 23, 1891.",irrigation;water storage,,,,1899 Statutes of Nevada,,Historical Statute,record,,,
wlc031,https://www.leg.state.nv.us/Statutes/19th1899/Stats189901.html#Stats189901page64,,,"Water Stored for Irrigation and its Uses, 1899 Nev. Stat. 64",,1899-03-09,An Act to provide for turning water stored for irrigation or other beneficial purposes into the channel of any stream and for reclaiming the same.,storage;streams;irrigation,,,,1899 Statutes of Nevada,,Historical Statute,record,,,
wlc032,https://www.leg.state.nv.us/Statutes/19th1899/Stats189901.html#Stats189901page115,,,"Board of Water Commissioners Created, 1899 Nev. Stat. 115",,1899-03-16,"An Act to define and preserve existing water rights, provide for the storage of surplus water, and regulate the mode of using and acquiring the use of water in the future.",surplus water;lakes;appropriation;investigation,,,,1899 Statutes of Nevada,,Historical Statute,record,,,
wlc033,https://www.leg.state.nv.us/Statutes/21st1903/Stats190301.html#Stats190301page18,,,"Cooperation of the State of Nevada with the Secretary of the Interior in the United States, 1903 Nev. Stat. 18",,1903-01-30,"An Act providing for the cooperation of the State of Nevada with the Secretary of the Interior of the United States in the construction and administration of irrigation works for the reclamation of arid lands in the State of Nevada for the measurement, appropriation and distribution of water, determination of water rights, preserving and certifying records thereof, creating officers for the enforcement hereof, defining the tenure of office, powers and duties and fixing their compensation; providing for penalties for infringements hereof, and enacting a standard measure of water and conferring upon the Secretary of the Interior such rights and powers under the laws of Nevada as are necessary to enable him to carry out and execute an Act of the Congress of the United States, approved June 17, 1902, entitled “An Act appropriating the receipts from the sale and disposal of public lands in certain States and Territories to the construction of irrigation works for the reclamation of arid lands.”",vested rights;streams;rivers;appropriation;irrigation,,,,1903 Statutes of Nevada,,Historical Statute,record,,,
wlc034,https://www.leg.state.nv.us/Statutes/21st1903/Stats190301.html#Stats190301page71,,,"Method of Measuring Water, 1903 Nev. Stat. 71",,1903-03-09,"An Act to provide for the measurement of water used on irrigated areas, the determination of the losses from irrigating ditches and the remedies therefor, and the study of the best methods of distributing and using water in growing crops in the State of Nevada, in cooperation with the United States Department of Agriculture and the Nevada Experiment Station.",irrigation;ditches;investigation,,,,1903 Statutes of Nevada,,Historical Statute,record,,,
wlc035,https://www.leg.state.nv.us/Statutes/22nd1905/Stats190501.html#Stats190501page67,,,"Duties of State Engineer, 1905 Nev. Stat. 67",,1905-03-01,"An Act amendatory of and supplemental to an Act entitled “An Act providing for the cooperation of the State of Nevada with the Secretary of the Interior of the United States in the construction and administration of irrigation works for the reclamation of arid lands in the State of Nevada, for the measurement, appropriation and distribution of water, determination of water rights, preserving and certifying records thereof, creating officers for the enforcement hereof, defining the tenure of office, powers and duties and fixing their compensation; providing for penalties for infringements hereof, and enacting a standard measure of water, and conferring upon the Secretary of the Interior such rights and powers under the laws of Nevada as are necessary to enable him to carry out and execute an Act of the Congress of the United States, approved June 17, 1902, entitled ‘An Act appropriating the receipts from the sale and disposal of public lands in certain States and Territories, to the construction of irrigation works for the reclamation of arid lands,’ ” approved February 16, 1903.",irrigation;appropriation,,,,1905 Statutes of Nevada,,Historical Statute,record,,,
wlc036,https://www.leg.state.nv.us/Statutes/22nd1905/Stats190502.html#Stats190502page197,,,"Measuring Water on Irrigated Areas, 1905 Nev. Stat. 197",,1905-03-17,"An Act to provide for the measurement of water used on irrigated areas, the determination of the losses from irrigating ditches and the remedies therefor, and the study of the best methods of distributing and using water in growing crops in the State of Nevada, in cooperation with the United States Department of Agriculture and the Nevada Experiment Station.",irrigation;ditches;appropriation;investigation,,,,1905 Statutes of Nevada,,Historical Statute,record,,,
wlc037,https://www.leg.state.nv.us/Statutes/22nd1905/Stats190502.html#Stats190502page257,,,"Wells in Southern Nevada, 1905 Nev. Stat. 257",,1905-03-24,"An Act to provide for the sinking, boring and development of wells in Southern Nevada.",wells;appropriation;vested rights,,,,1905 Statutes of Nevada,,Historical Statute,record,,,
wlc038,https://www.leg.state.nv.us/Statutes/23rd1907/Stats190701.html#Stats190701page30,,,"Appropriation of Waters for Public Use, 1907 Nev. Stat. 30",,1907-02-26,"An Act to provide for the appropriation, distribution and use of water, and to define and preserve existing water rights, to provide for the appointment of a State Engineer, an Assistant State Engineer, and fixing their compensation, duties and powers, defining the duties of the State Board of Irrigation, providing for the appointment of Water Commissioners and defining their duties.",appropriation,,,,1907 Statutes of Nevada,,Historical Statute,record,,,
wlc039,https://www.leg.state.nv.us/Statutes/23rd1907/Stats190701.html#Stats190701page38,,,"Repeal of Previous Acts, 1907 Nev. Stat. 38",,1907-02-26,"Section 32 of 1907 Nev. Stat. 30 - Repeal of previous acts from 1902, 1903, and 1905",repeal of previous acts;,,,,1907 Statutes of Nevada,,Historical Statute,record,,,
wlc040,https://www.leg.state.nv.us/Statutes/23rd1907/Stats190702.html#Stats190702page279,,,"Eminent Domain, 1907 Nev. Stat. 279",,1907-03-27,An Act to regulate the exercise of the right of eminent domain.,eminent domain;public use;reservoirs;dams;ditches;flumes;irrigation,,,,1907 Statutes of Nevada,,Historical Statute,record,,,
wlc041,https://www.leg.state.nv.us/Statutes/26th1913/Stats191301.html#Stats191301page12,,,"County Commissioners Authorized to Sink Artesian Wells, 1913 Nev. Stat. 12",,1913-02-20,"An Act authorizing the board of county commissioners of the various counties in the state to acquire real estate and to sink, or cause to be sunk thereon, artesian wells, and making the expense thereof a legal charge against the county.",wells,,,,1913 Statutes of Nevada,,Historical Statute,record,,,
wlc042,https://www.leg.state.nv.us/Statutes/26th1913/Stats191301.html#Stats191301page35,,,"Consenting to use of Lake Tahoe by U.S. Reclamation Service, 1913 Nev. Stat. 35",,1913-03-06,"An Act consenting to the use by the United States of America of Lake Tahoe, its waters, bed, shores, and capability of use for reservoir purposes, in connection with the Truckee-Carson reclamation project of the reclamation service of the United States.",Lake Tahoe;reclamation;lakes;reservoirs,,,,1913 Statutes of Nevada,,Historical Statute,record,,,
wlc043,https://www.leg.state.nv.us/Statutes/26th1913/Stats191301.html#Stats191301page40,,,"Artesian Wells, 1913 Nev. Stat. 40",,1913-03-07,An Act to provide a law for the conservation of underground waters in the State of Nevada; provided for the casing and capping of artesian wells; and providing a penalty for the violation of the provisions of such act.,underground;wells;beneficial use,,,,1913 Statutes of Nevada,,Historical Statute,record,,,
wlc044,https://www.leg.state.nv.us/Statutes/26th1913/Stats191302.html#Stats191302page256,,,"Permits for Water When Point of Diversion is Outside the State of Nevada, 1913 Nev. Stat. 256",,1913-03-22,"An Act relating to the issuance of permits for the appropriation of water, where the works or any part thereof to be constructed under such permits or the point of diversion or place of intended use, or any part thereof are situated without the State of Nevada.",appropriation,,,,1913 Statutes of Nevada,,Historical Statute,record,,,
wlc045,https://www.leg.state.nv.us/Statutes/26th1913/Stats191302.html#Stats191302page257,,,"Measurement of Water on Irrigated Lands, 1913 Nev. Stat. 257",,1913-03-22,"An Act to provide for the measurement of water used on irrigation areas, the determination of the losses from irrigating ditches and the remedies therefor, and a study of the evaporation losses and the remedies therefor, and a study of the best methods of distributing and applying water in growing crops in the State of Nevada, in cooperation with the United States department of agriculture, the Nevada agricultural experiment station, and the state engineer.",irrigation;ditches;investigation,,,,1913 Statutes of Nevada,,Historical Statute,record,,,
wlc046,https://www.leg.state.nv.us/Statutes/26th1913/Stats191302.html#Stats191302page261,,,"Investigation of Water Resources in Cooperation with U.S. Geological Survey, 1913 Nev. Stat. 261",,1913-03-22,"An Act to provide for the investigation of the water resources of the State of Nevada in cooperation with the United States geological survey, and to make an appropriation for the expense of such investigations.",investigation,,,,1913 Statutes of Nevada,,Historical Statute,record,,,
wlc047,https://www.leg.state.nv.us/Statutes/26th1913/Stats191303.html#Stats191303page461,,,"Petition for Drainage District, 1913 Nev. Stat. 461",,1913-03-31,"An Act to provide for the organization and government of drainage districts and to provide for the acquisition, repair and development of canals, drains, ditches, watercourses and other property, and for the distribution of water thereby for drainage purposes, and to provide for the levying of taxes and for the issuing and sale of bonds thereof.",canals;drains;ditches,,,,1913 Statutes of Nevada,,Historical Statute,record,,,
wlc0481,wlc0481.pdf,,,"Van Sickle v. Haynes, 7 Nev. 249",,1872-01,"The water appropriator sought damages for the landowner's diversion of water from a creek that flowed over the property of the landowner, but not over the land of the water appropriator. The water appropriator had diverted a portion of the water from the creek before the United States awarded the land patent to the landowner. The lower court found that the water appropriator had an interest in the water that was protected in equity. The landowner appealed, and the court reversed. The court held that: (1) running water was an incident to the soil over which it naturally flowed; (2) the right of the riparian proprietor did not depend upon the appropriation of the water by him to any special purpose, but was a right incident to his ownership of the land to have the water flow in its natural course and condition, subject only to those changes that were occasioned by the use by proprietors above him; and (3) the government patent to the landowner conveyed not only the land, but also the stream naturally flowing through it.",appropriation;riparian;streams;rivers;creek,"Douglas County, NV",38.95065691,-119.7682203,7 Nev. 249,,Case Law,application/pdf,,,
wlc0491,wlc0491.pdf,,,"Barnes v. Sabron, 10 Nev. 230",,1875-07,"The farmer alleged that the diversion of water from a creek had deprived him of sufficient water to irrigate his crops. The court held that the farmer, as the first appropriator of the waters of the creek, had the right to take the water flowing therein, during the irrigation season, for his reasonable use and enjoyment to the full extent of his original appropriation and beneficial use. The court determined that the creek was a natural watercourse and surface stream and that the trial court's findings to the contrary were without substantial support in the testimony. The court held that even if the farmer was negligent in allowing his tenants to use more water than was necessary to irrigate their crops, he could recover at least nominal damages and costs, with a decree for equitable relief.",irrigation;appropriation;creek;springs;ditches;beneficial use,"Nye County, NV",38.11862807,-116.4113373,10 Nev. 230,,Case Law,application/pdf,,,
wlc0501,wlc0501.pdf,,,"Jones v. Adams, 19 Nev. 78",,1885-04,"The trial court held that appellant and respondent were the owners, respectively, by rights of appropriation and use, of seven-tenths part and three-tenths part of the water flowing from a particular stream. The court, after granting appellant's motion for a rehearing, affirmed. Had the principles of common law in relation to riparian rights been applied, both appellant and respondent would have been allowed a reasonable use of the water. Thus, if the judgment had been rendered upon the common law principles of riparian rights, it would have been at least as favorable to respondent as the judgment was now. The trial court did not err, however, when it instead applied the principle of prior appropriation pursuant to U.S. Rev. Stat. § 2339, § 9 (1866) in rendering judgment. The purpose of the statute was to give the sanction of the government to possessory rights acquired under local customs, laws, and decisions of the courts. The statute was a voluntary recognition of a preexisting right of possession and its continued use, rather than the establishment of a new right. The court overruled Vansickle v. Haines, 7 Nev. 249 (1872) to the extent it conflicted with the court's holding.",streams;appropriation;irrigation;ditches;riparian,"Douglas County, NV",38.95065691,-119.7682203,19 Nev. 78,,Case Law,application/pdf,,,
wlc0511,wlc0511.pdf,,,"Ormsby County v. Kearney, 37 Nev. 314",,1914-07,"This case involved the constitutionality of certain provisions of the water law. The claimants contended that the state engineer did not have the right or authority to hear or determine any matter related to the appropriation of the water and that the provisions authorizing the state engineer to determine the rights of water appropriators were unconstitutional. After reviewing the questioned provisions of said act, this court concluded that the act did not violate the due process of law provisions of the state or federal constitutions. The act, however, did not authorize and empower the state engineer to adjudicate and determine the right, title, and interest of complainants to the use of the water. It did authorize the state engineer to investigate and determine the relative rights of water appropriators or users upon any stream or stream system.",appropriation;vested rights;streams;irrigation,"Carson City, NV",39.164722,-119.776389,37 Nev. 314,,Case Law,application/pdf,,,
wlc0521,wlc0521.pdf,,,"Lobdell v. Simpson, 2 Nev. 274",,1866-07,"The lower riparian occupant seemed to have relied solely upon his prior appropriation of the waters of a creek. No rights by virtue of his riparian proprietorship seemed to have been claimed. On appeal, the court held that as the main issue raised by the pleadings was priority of appropriation, the trial court erred in refusing to instruct the jury, as requested by the upper riparian owners, that the lower riparian occupant was not entitled to any greater quantity of the water of the creek than he actually appropriated prior to the upper riparian owners' appropriation. The court stated that the evidence in the case not having been brought up, it was unable to determine what the rights of the upper riparian owners were but that if the facts existed as set forth in the answer, the upper riparian owners had a right to maintain the dam and ditch complained of by the lower riparian occupant by which they diverted the water from the natural channel of the creek as they found it at the time of their location.",appropriation;streams;creek;ditches;dams;riparian;prior appropriation,"Esmerelda County, NV",37.71485,-117.675605,2 Nevv. 274,,Case Law,application/pdf,,,
wlc0531,wlc0531.pdf,,,"Carson City v. Eastate of Lompa, 88 Nev. 541",,1972-10,"Water rightrs may be sold, condemned or leased. ",appropriation;acquired rights;diversion;prior appropriation;,"Carson City, NV",39.164722,-119.776389,88 Nev. 541,,Case Law,application/pdf,,,
wlc0541,wlc0541.pdf,,,"Application of Filippini, 66 Nev. 17",,1949-01,"The applicant sought approval to appropriate certain waters and the protester objected. After the application was granted, the protester filed an action against the state engineer and the applicant. The trial court dismissed the action and the protester appealed. The court ordered the matter remanded to the trial court, holding that the state had the constitutional power to control and regulate public waters. The Water Act of 1913 (Act) provided the method for appropriating water and the means for determining the water users' rights. Any vested water rights which were impaired by the Act were excluded from its operation. Adverse use of water rights was wholly unwarranted, unnecessary, and dangerous to the appropriation and distribution of public property, the water rights. A potential water user was no longer able to acquire water rights by adverse possession. The Act also established the procedures for obtaining water rights; power was in the state engineer to determine preexisting rights and distributing new ones. There were several factual questions which needed to be answered, however, including the question of what the protester's prior water rights may have been.",appropriation;acquired rights;beneficial use;diversion;streams;vested rights;,"Eureka County, NV",40.19443229,-116.376643,66 Nev. 17,,Case Law,application/pdf,,,
wlc0551,wlc0551.pdf,,,"G&M Properties v. Second Judicial Dist. Court, 95 Nev. 301",,1979-05,"The state engineer made a determination of the rights of various claimants to certain waters within the county. The other claimants did not filed an exception to the determination. The state engineer notified all parties of a scheduled date for a hearing on objections filed by certain claimants, which was to occur on March 31, 1977, and advised that all exceptions had to be filed five days prior thereto, pursuant to Nev. Rev. Stat. § 533.170. The other claimants did not file a notice challenging the determination. The hearing was reset for July 10, 1978, and the state engineer notified all parties of the new hearing date. On the date of the hearing, the other claimants filed exceptions for the first time. Respondent allowed the late filing and granted the other claimants discovery. Petitioners filed for a writ of prohibition asserting that respondent was without jurisdiction to consider the tardy claims. The court granted the writ, holding that the requirements of § 533.170 were mandatory and jurisdictional. In that the other claimants failed to file their exceptions within the required time under § 533.170, respondent had no jurisdiction to consider the",NRS 533.170;vested rights;permited rights,"Washoe County, NV",39.29923806,-119.8705246,95 Nev. 301,,Case Law,application/pdf,,,
