objectid,filename,youtubeid,vimeoid,title,creator,date,description,subject,location,latitude,longitude,source,identifier,type,format,language,rights,rightsstatement
wlc001,wlc001.pdf,,,"Diamond Nat. Res. Prot. & Conservation Ass’n. v. Diamond Valley Ranch, LLC, 138 Nev. Adv. Rep. 43",,2022-06-16,acre feet;wells,prior appropriation;beneficial use;appropriation;priority rights;vested rights;over-appropriated;groundwater management plan;NRS 534.110;NRS 534.110;critical water shortages;wells,"Diamond Valley, NV",39.7596,-115.97339,138 Nev. Adv. Rep. 43,,Case Law,application/pdf,,,
wlc002,wlc002.pdf,,,"Wilson v. Pahrump Fair Water, LLC, 137 Nev. Adv. Rep. 2",,2021-02-25,"The district court's order, which invalidated a Order No. 1293A issued by the State Engineer, was reversed, and the case was remanded because Nev. Rev. Stat. § 534.110(8) authorized the 2.0 acre-feet annually from an alternate source requirement under the particular circumstances, the State Engineer's critical requisite determination was that the drilling of any new domestic wells in the Pahrump Artesian Basin would threaten the supply of water to existing wells, that assessment was supported by substantial evidence, and the State Engineer was not required to hold a hearing or develop a more robust record; the State Engineer was not required to provide notice and a hearing regarding the 2.0 acre-feet annually from an alternate source requirement under the particular circumstances.",domestic wells;wells;prior appropriation;critical management area;alternate source;active management area;NRS 534.180;NRS 534.080;riparian,"Pahrump, NV",36.20749812,-115.9911882,137 Nev. Adv. Rep 2,,Case Law,application/pdf,,,
wlc003,wlc003.pdf,,,"Mineral Cty v. Lyon Cty., 136 Nev. Adv. Rep. 58",,2020-09-17,"The public trust doctrine, as implemented through Nevada's comprehensive water statutes, did not permit the reallocation of water rights already adjudicated and settled under the doctrine of prior appropriation; [2]-The public trust doctrine applied in Nevada to all waters within the state, including those previously allocated under prior appropriation; [3]-Nevada's statutory water scheme is consistent with the public trust doctrine by requiring the State Engineer to consider the public interest when allocating and administering water rights.",public trust;lakes;reallocation;public interest;navigable;beneficial use;public use;vested rights;NRS 533.430;NRS 533.265;NRS 533.090;NRS 533.035;NRS 533.030;NRS 533.325;NRS 533.370;abandoned;forfeited water rights;NRS 534.120;NRS 533.0245;NRS 533.210;taking,"Mineral County, NV",38.688254,-118.693706,136 Nev. Adv. Rep 58,,Case Law,application/pdf,,,
wlc101,wlc101.pdf,,,"Wilson v. Happy Creek, Inc., 135 Nev. 301",,2019-09-12,"The district court did not err in granting equitable relief from the new priority date that Nev. Rev. Stat. § 533.395(3) mandated the Nevada State Engineer to assign after the water rights permit holder missed the deadline for filing proofs of beneficial use; the solution offered by the State Engineer's strict reading of § 533.395 fell short under the circumstances, and restoration of the original priority dates better promoted the state's interests in efficiency, sustainability, fairness, and clarity.",irrigation;beneficial use;appropriation;over-appropriated;NRS 533.395;NRS 533.380;NRS 533.410,"Humboldt County, NV",41.49896736,-118.3634154,135 Nev. 301,,Case Law,application/pdf,,,
wlc100,wlc100.pdf,,,Sierra Pac. Indus. v. Wilson; 135 Nev. 105,,2019-05-02,"Because the anti-speculation doctrine applied to requests for extensions of time to put water to beneficial use under Nev. Rev. Stat. § 533.380 (2013), an applicant seeking an extension of time on an existing permit without intending to use the water for its own benefit was required to show an agency or contractual relationship with the party that would put the water to beneficial use, in addition to specifying the intended beneficial use of the appropriation; [2]-A holder of water rights permits to transmit water to a specified location for municipal use failed to show reasonable diligence under Nev. Rev. Stat. § 533.395(1) because it claimed only a generic option contract, which was too speculative, in stating it had entered into option agreements with unidentified engineering and construction firms while negotiating with a public utility company outside the permit area.",beneficial use;appropriation;NRS 533.380;NRS 533.395;NRS 533.025;NRS 533.370,"Lemmon Valley, NV",39.63895747,-119.8439295,135 Nev. 105,,Case Law,application/pdf,,,
wlc006,wlc006.pdf,,,"Eureka Cty. v. Seventh Judicial Dist. Court of Nev., 134 Nev. 275",,2018-05-17,Notice had to be given to junior water rights holders before a show cause hearing in a writ proceeding by a senior water rights holder asking the state engineer to curtail junior water rights because constitutional due process required that the junior water rights holders were entitled to be present for the trial court's consideration of the curtailment request; [2]-The court issued a writ of mandamus directing the trial court to enter an order requiring that notice be provided to all junior water rights holders in the area prior to any show cause hearing being conducted because due process required notice to be given to the junior water rights holders.,appropriation;NRS 534.110,"Eureka County, NV",39.99062099,-116.2228344,134 Nev. 275,,Case Law,application/pdf,,,
wlc007,wlc007.pdf,,,"King v. St. Clair, 134 Nev. 137",,2018-03-29,"A state engineer's finding of abandonment pursuant to Nev. Rev. Stat. § 534.090(4) (2011) was unsupported by substantial evidence because an extended period of nonuse of water did not in itself establish clear and convincing evidence that a property owner intended to abandon a water right connected to the property, and there was no additional evidence indicating an intent to abandon; [2]-The district court did not violate Nev. R. Civ. P. 52 by adopting in full an order drafted by the property owner because the fact that the district court found the state engineer's objections to specific language within that order unpersuasive did not mean that the district court neglected its duty to make factual findings, and it was common practice for district courts to direct the prevailing party to draft the order.",abandoned;nonuse;underground;NRS 534.100;NRS 534.090,"Humboldt County, NV",41.23540991,-118.1525314,134 Nev. 137,,Case Law,application/pdf,,,
wlc008,wlc009.pdf,,,"State Eng'r v. Eureka Cty, 133 Nev. 557",,2017-09-27,"The district court acted consistently with the prior appeal when it granted a previously-denied petition for judicial review in a water law matter and vacated an applicant's permits because the State Engineer relied on insufficient facts before granting the applicant's applications, the Supreme Court of Nevada gave no order to remand to the State Engineer, and the applicant was not entitled to a do-over after failing to provide substantial mitigation evidence.",NRS 533.370,"Eureka County, NV",40.19443229,-116.376643,133 Nev. 557,,Case Law,application/pdf,,,
wlc009,wlc010.pdf,,,"Jackson v. Groenendyke, 132 Nev. 296",,2016-04-07,"Because respondent's supplemental exception, in which he asked the district court to order that he be allowed access to the pipeline located on appellant's property, arose from the same dispute adjudicated by the Nevada State Engineer in its final order of determination, the district court had jurisdiction to consider respondent's supplemental exception; appellant was not prejudiced by the district court's consideration of respondent's motion for access in his supplement, and the requirements of Nev. R. Civ. P. 15(c) were satisfied; [2]-The district court did not err in agreeing with the State Engineer that the set of properties had a vested water right.",vested rights;NRS 533.160;NRS 533.170,"Douglas County, NV",38.98042934,-119.6792206,132 Nev. 296,,Case Law,application/pdf,,,
wlc010,wlc011.pdf,,,"Eureka Cnty v. State Eng'r of Nev., 131 Nev. 846",,2015-10-29,"Substantial evidence did not support the Nevada State Water Engineer's finding that the applicant would be able to adequately and fully mitigate the fact that its groundwater appropriations would cause the spring that sources existing rights to cease to flow; [2]-The State Engineer's decision to grant the applications, when the result of the appropriations would conflict with existing rights, and based upon unsupported findings that mitigation would be sufficient to rectify the conflict, violated the legislature's directive in Nev. Rev. Stat. § 533.370(2) that the State Engineer must deny use or change applications when the use or change would conflict with existing rights.",appropriation;groundwater;water table;NRS 533.370;NRS 533.365,"Eureka County, NV",40.19443229,-116.376643,131 Nev 846,,Case Law,application/pdf,,,
wlc011,wlc012.pdf,,,"Benson v. State Eng'r, 131 Nev. 772",,2015-09-24,"Nev. Rev. Stat. § 533.395(2) requires a party aggrieved by the cancellation of a water permit to exhaust all available administrative remedies before seeking judicial review, even when the remedy that the State Engineer is authorized to provide is not the remedy that the party seeks; [2]-Administrative proceedings were not futile, even though the State Engineer was limited, if the cancellation was rescinded, to reinstating the water permit with a priority date of 2013, rather than the original priority date of 1960, as sought by the permittee; [3]-The district court properly ruled that it could not grant the permittee equitable relief; her suspicions that the administrative remedy would be inadequate were unsupported.",appropriation;beneficial use;NRS 535.395;NRS 533.384;NRS 533.450,"Eureka county, NV",40.19443229,-116.376643,131 Nev. 772,,Case Law,application/pdf,,,
wlc012,wlc013.pdf,,,"Land Baron Invs., Inc. v. Bonnie Springs Family Ltd. P'ship, 131 Nev. 686",,2015-09-17,"The district court did not err in denying appellant's motion for summary judgment on its mutual mistake rescission claim because it provided no evidence that respondents ever represented that there would be no impediment to gaining access for a subdivision via either of two roads, or that respondents had stated that it would supply the property with water; [2]-Respondents were not liable for nondisclosure regarding water rights or access because appellant could have, and did, discover the facts surrounding the difficulty or impossibility of obtaining sufficient water and access for a subdivision; those defects arose from government regulations, were public knowledge, and were available to anyone upon inquiry; [3]-Respondents failed to establish the elements of abuse of process.",inspection,"Bonnie Springs, NV",36.05979379,-115.4534679,131 Nev. 686,,Case Law,application/pdf,,,
wlc013,wlc014.pdf,,,"In re Nev. State Eng'r Ruling No. 5823, 128 Nev. 232",,2012-05-31,"The ruling allocated groundwater rights in a basin that was wholly within another county but was hydrologically connected to the surface waters of a river in which the petitioning county and the tribe had an interest. The State Engineer sought a change of venue to the county in which the basin was located. Some applicants challenged the district court's subject matter jurisdiction. The district court concluded that it lacked subject matter jurisdiction and dismissed the case without considering the administrative record. The court held that Nev. Rev. Stat. § 533.450(1) did not vest exclusive jurisdiction in the court of the county where all or part of the applicant's water rights were situated, unless the exception for stream systems governed by a decree of court applied. Instead, the statute's wording plainly contemplated more than one permissible forum, depending on the location, nature, and origin of the interests allegedly affected. Moreover, the general forum clause in Nev. Rev. Stat. § 533.450(1) addressed venue, rather than subject matter jurisdiction. Thus, the district court could determine venue under the general venue statutes in Nev. Rev. Stat. ch. 13 as appropriate.",streams;groundwater;surface water;NRS 533.450,"Churchill County, NV",39.5043023,-118.2975122,128 Nev. 232,,Case Law,application/pdf,,,
wlc014,wlc015.pdf,,,"Pyramid Lake Paiute Tribe of Indians v. Ricci, 126 Nev. 521",,2010-12-16,"The supreme court noted that because the tribe did not have rights to the Dodge Flat groundwater, the State Engineer appropriately excluded the tribe's unauthorized use to determine if the basin contained unappropriated water. The change applications would not affect existing water rights. Based on the tribe's own evidence, the change application would not affect its senior water rights under the Orr Ditch decree. Because the tribe had no authorization to use the Dodge Flat groundwater, its use did not have priority over the company's rights. The change use application did not threaten to prove detrimental to the public interest. The company was only permitted to pump water up to the amount of the unappropriated perennial yield. The State Engineer imposed this limitation in part to protect the Truckee River water quality and native fish habitats. Any potential threat to the public interest was therefore not the result of the company's proposed change. Rather, the potential threat was again the consequence of the tribe's continued pumping Dodge Flat groundwater without a permit or implied right.",groundwater;reservation;lakes;unappropriated;NRS 533.024;NRS 533.370,"Pyramid Lake Paiute Reservation, NV",39.9735522,-119.4871139,126 Nev. 521,,Case Law,application/pdf,,,
wlc015,wlc016.pdf,,,"Howell v. Ricci, 124 Nev. 1222",,2008-12-24,"The supreme court noted that it had to address what constituted a State Engineer decision subject to review and whether a petition for extraordinary writ relief was the proper procedural mechanism to review such a decision. The State Engineer's November 23, 2005, letter to the landowners was reviewable under Nev. Rev. Stat. § 533.450(1) because in that letter the State Engineer communicated its refusal to open the headgates to the landowners' property and amended respondent company's permits to exclude the landowners' water rights. That decision affected the landowners' interest with respect to their rights to use the water. Judicial review was the proper procedural mechanism for reviewing a State Engineer's decision. Since the State Engineer never had authority to resolve title questions, and the 2005 legislative amendments clarified that the State Engineer lacked that authority, contrary to the landowners' contentions, the 2005 legislative amendments to Nev. Rev. Stat. ch. 533 did not have any effect on the case.",diversion;NRS 533.450;NRS 533.024;NRS 533.386,"Humboldt County, NV",41.23540991,-118.1525314,124.Nev. 1222,,Case Law,application/pdf,,,
wlc016,wlc017.pdf,,,"Adaven Mgmt. v. Mt. Falls Acquisition Corp., 124 Nev. 770",,2008-09-11,"The previous owner of the property had received a loan from respondent bank. The security for the loan included the water rights permit but not the land to which it was appurtenant. The purchaser argued that Nev. Rev. Stat. § 533.040 and the anti-speculation doctrine precluded the previous owner from validly pledging the permit as security for a loan without also pledging the land to which the permit was appurtenant or seeking severance of the water right from the land. The court concluded that summary judgment for the permit holder was appropriate because no genuine issue of material fact existed regarding the purchaser's notice of the bank's interest in the permit. Neither § 533.040 nor the anti-speculation doctrine limited the free alienability of water rights as separate property. Because the bank had properly recorded its interest in the permit before the purchaser took title to the land, the purchaser had constructive notice of the permit's mortgage and sale and did not take title to those water rights. No genuine issue of material fact existed concerning whether a search of the grantee-grantor indices would have revealed the deed of trust encumbering the permit.",beneficial use;acre feet;NRS 533.040;NRS 247.150;NRS 111.312,"Nye County, NV",38.11862807,-116.4113373,124 Nev. 770,,Case Law,application/pdf,,,
wlc017,wlc018.pdf,,,"Andersen Family Assocs. v. Ricci, 124 Nev. 182",,2008-03-27,"The sole issue was whether the city had lost priority in certain vested water rights after the State Engineer canceled and later reinstated a permit modifying the use of those rights pursuant to Nev. Rev. Stat. § 533.395. Two unambiguous statutes were in conflict: Nev. Rev. Stat. §§ 533.085(1) and 533.395(3). The argument that vested water rights could be lost by applying for and receiving a permit modifying the use of those rights failed as nothing in Nev. Rev. Stat. ch. 533 or prior case law suggested that an application to modify vested rights amounted to intentional abandonment of those rights. Thus, the cancellation and later reinstatement of the city's permit did not affect its underlying vested rights. Although it lost the right to use the water in the approved manner when the permit was cancelled, it did not lose the priority attached to its vested rights because such a result would have impaired the city's vested rights in violation of Nev. Rev. Stat. § 533.085(1). The city's decision to apply for a permit did not subject its water rights to Nev. Rev. Stat. § 533.395(3) because although it changed the use, its vested rights remained of the same character.",vested rights;appropriation;creek;forfeited water rights;NRS 533.395;NRS 533.085,"Carson City, NV",39.16647354,-119.7653437,124 Nev. 182,,Case Law,application/pdf,,,
wlc018,wlc019.pdf,,,"Bacher v. Office of the State Eng'r of Nev., 122 Nev. 1110",,2006-11-22,"A real estate company owned a number of acres of land in Nevada and California. The city had three casinos, a mall, a welcome center, and a power plant. These facilities' water needs were serviced by a corporation, the entity under which the real estate company held water rights. The real estate company sought to expand its operation. The residents argued that, as a matter of law, Nev. Rev. Stat. § 533.370(6)(a) could only be satisfied by an applicant presenting evidence of personal need for water. The supreme court considered whether an agent could properly apply for water rights permits on behalf of the actual appropriator. The supreme court concluded that an agent could request permits based on the ultimate user's need for water. Nevertheless, the supreme court also adopted an anti-speculation doctrine, which required the agent to have a contractual or agency relationship with the water's appropriator. In this case, the agent properly applied for a water rights permit on behalf of the appropriator; however, the supreme court concluded that the State Engineer failed to properly consider the evidence in determining the need for water in the import basin.",beneficial use;appropriation;groundwater;NRS 533.370,"Primm, NV",35.60824581,-115.384112,122 Nev. 1110,,Case Law,application/pdf,,,
wlc019,wlc020.pdf,,,"Dep't of Conservation & Natural Res. v. Foley, 121 Nev. 77",,2005-04-14,"The Nevada State Engineer granted a permit to the seller of land for well service to his four parcels of land. The permit required that the holder file certain certificates with the Division, including a Proof of Completion of Work and a Proof of Water to Beneficial Use. The seller failed to file a Proof of Water to Beneficial Use certificate. The Engineer subsequently cancelled the seller's permit. Prior to the cancellation, the seller conveyed two parcels of land to the purchasers. No one filed a report or record of the transactions with the Engineer. The purchasers filed an action for reinstatement of the permit. The trial court held that the purchasers were entitled to notice of cancellation and issued an injunction directing that the permit be reinstated. On appeal, the court found that the State of Nevada was under no obligation to give notice of cancellation to parties whose interests were not of record with the Division. The purchasers' failure to file reports with the Division constituted direct failures to comply with Nev. Rev. Stat. § 533.384(1)(a) (1995). Accordingly, the trial court abused its discretion when it provided injunctive relief.",beneficial use;NRS 533.384;NRS 533.386,"Clark County, NV",36.40932515,-115.1101231,121 Nev. 77,,Case Law,application/pdf,,,
wlc020,wlc021.pdf,,,"Preferred Equities Corp. v. State Eng'r, 119 Nev. 384",,2003-08-29,"In 1988, the corporation filed an application with the State Engineer to change the diversion point and usage of certain water rights. The State Engineer did not immediately act on that application and, in 1992, commenced separate forfeiture proceedings on the same water rights. In 1996, the State Engineer concluded that the corporation did not utilize the water rights for a period exceeding five years, and he declared the rights in forfeit. The corporation did not appeal. Thereafter, in 1997, the State Engineer issued another ruling denying the 1988 application to change the point of diversion and the usage of the rights that were declared forfeited in the first ruling. The corporation filed a petition for judicial review of the second ruling. The district court dismissed the petition. On appeal, the court affirmed, finding that, under Nev. Rev. Stat. § 534.090(1), the corporation's water rights reverted to the public once the State Engineer determined them forfeited and the forfeiture became final upon the corporation's failure to appeal that ruling within 30 days. Additionally, the court held that the application to change the manner of use did not toll the forfeiture period.",forfeited water rights;beneficial use;NRS 534.090;NRS 533.040;NRS 533.450,"Nye County, NV",38.11862807,-116.4113373,119 Nev. 384,,Case Law,application/pdf,,,
wlc021,wlc022.pdf,,,"S. Fork Band of the Te-Moak Tribe v. State Eng'r, in Re Determination of Relative Rights of Claimants and Appropriators of Waters of the Humboldt River Stream Sys., 118 Nev. 901",,2002-12-26,"Appellants challenged: (1) the trial court's order that the Tribe enact a legislative resolution to provide a safe environment for water commissioners and allow access to the tribal property by the water commissioners to carry out their duties under a modified set of water rights decrees, collectively known as the Humboldt Decree; (2) the trial court's order that it had to post a $ 10,000 bond; and (3) the tribal chairman's suspended three-day jail sentence. The instant court held that the trial court's contempt power did not encompass the power to order the Tribe to enact a legislative resolution. While the trial court had jurisdiction over the Tribe to ensure compliance with the Humboldt Decree, this jurisdiction did not extend to compelling legislative action by the Tribal Council. Requiring the Tribe to take legislative action constituted an abuse of discretion by the trial court. The trial court had the authority to require the Tribe to post a bond if it violated the valid portions of the contempt order in the future. The trial court abused its discretion in sentencing the tribal chairman to a suspended jail sentence for an official act.",contempt order;reservation;NRS 533.220;NRS 22.100,"Humboldt County, NV",41.49896736,-118.1525314,118 Nev. 901,,Case Law,application/pdf,,,
wlc022,wlc023.pdf,,,"United States v. State Eng'r, 117 Nev. 585",,2001-07-24,"The State denied nine applications filed by the BLM for stockwater permits, finding that the BLM was not a qualified applicant for stockwater permits. The BLM contended that the plain language of Nev. Rev. Stat. § 533.503 authorized the State to issue stockwater permits to the BLM, and if it did not, the statute was unconstitutional. The BLM argued that the phrase ""legally entitled"" was not ambiguous and meant that either the landowner, or a person with the landowner's permission to use the land, was legally entitled to place livestock on the land. The statute was not ambiguous. To say that the United States, as owner of the public land, had to issue itself a permit to lease or graze livestock upon the land was an illogical and unreasonable construction of the statutory language. The statute indicated it required an applicant to have some legal authority to use the public land for grazing purposes and nothing else. The BLM was a qualified applicant under Nev. Rev. Stat. § 533.503.",livestock;public use;watering;appropriation;natural resources;NRS 533.503;NRS 533.030;NRS 370; NRS 533.450,"Douglas County, NV",38.95065691,-119.7682203,117 Nev. 585,,Case Law,application/pdf,,,
